{
  "protocol_version": "0.1",
  "workspace_id": "workspace:basic-wiki",
  "title": "Basic OpenWiki",
  "default_language": "en",
  "repo_format": "openwiki-repo-v0",
  "runtime": {
    "profile": "local",
    "queue": {
      "backend": "local",
      "poll_ms": 1000,
      "max_jobs_per_worker": 1
    },
    "storage": {
      "backend": "local",
      "local_path": ".openwiki/objects",
      "inline_max_bytes": 65536
    }
  },
  "auth": {
    "service_accounts": []
  },
  "search": {
    "default_persona": "default",
    "default_limit": 20,
    "max_limit": 200,
    "max_query_length": 2000,
    "overfetch": 3,
    "rrf_k": 60,
    "ngram_min": 3,
    "fuzzy_min_length": 4,
    "fuzzy_mid_length": 7,
    "fuzzy_max_distance": 2,
    "enabled_retrievers": {
      "exact": true,
      "bm25": true,
      "ngram": true,
      "fuzzy": true,
      "graph": true
    },
    "persona_weights": {
      "default": {
        "exact": 2,
        "bm25": 1,
        "ngram": 0.8,
        "fuzzy": 0.6,
        "graph": 1
      },
      "researcher": {
        "exact": 1.8,
        "bm25": 1,
        "ngram": 0.9,
        "fuzzy": 0.7,
        "graph": 1.2
      },
      "editor": {
        "exact": 2.4,
        "bm25": 1.3,
        "ngram": 1,
        "fuzzy": 0.8,
        "graph": 0.9
      },
      "reviewer": {
        "exact": 1.8,
        "bm25": 1,
        "ngram": 0.8,
        "fuzzy": 0.6,
        "graph": 1.2
      },
      "governance": {
        "exact": 1.8,
        "bm25": 1.1,
        "ngram": 0.8,
        "fuzzy": 0.6,
        "graph": 1.3
      }
    }
  },
  "created_at": "2026-05-21T00:00:00.000Z"
}
